# asset	root	bytes_required_by	notes
metalsharp-electron.tar.zst	electron	mac	Electron application payload.
metalsharp-graphics-dll.tar.zst	Graphics/dll	mac	Frozen PR230 x64 DXMT surface plus the preserved i386 M10(32)/M11(32) lane; verified by tools/bundles/dxmt-surfaces.json.
metalsharp-runtime.tar.zst	runtime	mac	Wine runtime, host runtime ABI, and backend executable.
metalsharp-assets.tar.zst	assets	mac	Mono, GPTK, DXVK, Goldberg, shims, FNA kickstart (universal MonoKickstart + fnalibs), and runtime support assets.
fnalibs.tar.zst	fnalibs	mac	SDL2-linked FNA3D, FAudio, SDL2, theorafile, and real FMOD native payloads for FNA repair.
metalsharp-scripts-tools.tar.zst	scripts/tools	mac	Updater scripts, configs, native tools, and CEF compatibility helpers.
metalsharp-steam.tar.zst	steam	mac	Steam installer and Steam CEF wrapper assets.
metalsharp-d3d12-developer-sdk.tar.zst	developer-sdk/d3d12	mac,linux,windows	Self-contained D3D12 developer SDK with contracts, probes, docs, staged Wine runtime, and DXMT DLLs.
