# asset	root	bytes_required_by	notes
metalsharp-electron.tar.zst	electron	mac	Electron application payload.
metalsharp-graphics-dll.tar.zst	Graphics/dll	mac	DXMT D3D10/D3D11/D3D12 pipeline DLLs and winemetal bridge payload.
metalsharp-runtime.tar.zst	runtime	mac	Wine 11.5 runtime, host runtime ABI, backend executable, legacy hook surface, D3DMetal loader compatibility, Mono/Gecko, MoltenVK/Vulkan, and staged x86_64 dylib support assets (Apple D3DMetal payload user-staged separately).
metalsharp-assets.tar.zst	assets	mac	Mono, DXVK, Goldberg, shims, FNA kickstart (universal MonoKickstart + fnalibs), and runtime support assets; Apple GPTK/D3DMetal payloads are intentionally excluded.
fnalibs.tar.zst	fnalibs	mac	SDL2-linked FNA3D, FAudio, SDL2, theorafile, and real FMOD native payloads for FNA repair.
metalsharp-scripts-tools.tar.zst	scripts/tools	mac	Updater scripts, configs, native tools, D3DMetal payload staging/patching tools, and CEF compatibility helpers.
metalsharp-steam.tar.zst	steam	mac	Steam installer and Steam CEF wrapper assets.
metalsharp-d3d12-developer-sdk.tar.zst	developer-sdk/d3d12	mac,linux,windows	Self-contained D3D12 developer SDK with contracts, probes, docs, staged Wine runtime, and DXMT DLLs.
